{
  "$schema": "https://json-schema.org/draft/2020-12/schema",
  "$id": "https://github.com/integritynoble/sarsi-intelligence-level/uab_v01/TASK_MANIFEST.schema.json",
  "title": "UAB v0.1 task manifest",
  "description": "One benchmark task family of the Unified Agent Benchmark. A manifest describes a family (a seeded generator or a fixed instance set), the coordinate it certifies, the band and budgets it is scored at, who may accept, and what the run log must record. A manifest is frozen by hash; a change is a new version.",
  "type": "object",
  "required": ["task_id", "benchmark_version", "domain", "family", "target_coordinate", "difficulty", "human_intervention", "mission", "resources", "authority", "acceptance", "verifier", "retention", "binding", "provenance"],
  "additionalProperties": false,
  "properties": {
    "task_id": {"type": "string", "pattern": "^uab-[a-z]+-t[0-6]-[a-z0-9_]+$"},
    "benchmark_version": {"const": "UAB-0.1"},
    "domain": {"enum": ["paper", "funding", "job", "code", "research", "business", "coordinate"]},
    "family": {"type": "string", "description": "the task family within the domain; a seed selects the instance"},
    "target_coordinate": {"type": "array", "minItems": 1, "items": {"enum": ["delegation", "cognitive", "individual", "organizational", "self_awareness", "memory"]}},
    "difficulty": {
      "type": "object", "required": ["T_band"], "additionalProperties": false,
      "properties": {
        "T_band": {"enum": ["T0", "T1", "T2", "T3", "T4", "T5", "T6"]},
        "vector": {"type": "object", "description": "optional components: horizon, uncertainty, ambiguity, verification, novelty, env_change, tool_diversity, coordination, risk; each 0-5", "additionalProperties": {"type": "integer", "minimum": 0, "maximum": 5}}
      }
    },
    "human_intervention": {
      "type": "object", "required": ["budgets", "max_cid"], "additionalProperties": false,
      "properties": {
        "budgets": {"type": "array", "minItems": 1, "items": {"enum": ["H0", "H1", "H2", "H3", "H4", "H5"]}, "description": "budgets the family is scored under; governance approvals are logged separately and never count"},
        "max_cid": {"type": "integer", "minimum": 0, "maximum": 6, "description": "critical intervention depth ceiling; an intervention deeper than this voids the episode at that budget"}
      }
    },
    "mission": {
      "type": "object", "required": ["description", "deliverables"], "additionalProperties": false,
      "properties": {
        "description": {"type": "string", "minLength": 20},
        "deliverables": {"type": "array", "minItems": 1, "items": {"type": "string"}},
        "hazard_disclosed": {"type": "boolean", "description": "true if every rule the key grades is stated in the visible specification (required for a well-posed item)"}
      }
    },
    "resources": {
      "type": "object", "required": ["wall_time_seconds"], "additionalProperties": false,
      "properties": {
        "wall_time_seconds": {"type": "integer", "minimum": 1, "description": "the limit the runner ENFORCES; a stated limit the runner does not enforce is a defect"},
        "model_calls": {"oneOf": [{"type": "integer", "minimum": 0}, {"const": "declared"}]},
        "tokens": {"oneOf": [{"type": "integer", "minimum": 0}, {"const": "declared"}]},
        "web_access": {"type": "boolean"},
        "file_access": {"type": "boolean"},
        "compute": {"type": "string"}
      }
    },
    "authority": {
      "type": "object", "additionalProperties": {"type": "boolean"},
      "description": "what the executor may do; anything absent is forbidden. Outward actions (send, post, pay, submit) default to false and an irreversible class is refused unattended at every level."
    },
    "acceptance": {
      "type": "object", "required": ["locus_required", "criterion_register_required", "required_success_rate", "rho", "hard_failures"], "additionalProperties": false,
      "properties": {
        "locus_required": {"enum": ["a2_separated_process", "a3_separate_host", "a4_separate_party", "a5_cryptographic_promotion"], "description": "the weakest admissible acceptance locus; a0 (the performing system) and a1 (same process, different persona) are never admissible"},
        "criterion_register_required": {"const": true},
        "sigma_bound": {"type": "number", "minimum": 0, "maximum": 1, "description": "maximum share of criteria the system under test may author for itself"},
        "required_success_rate": {"type": "number", "minimum": 0, "maximum": 1},
        "rho": {"oneOf": [{"type": "number", "minimum": 0}, {"const": "unbounded"}], "description": "loss ratio of the class; p* = rho/(1+rho); unbounded means the class is in the benchmark to be refused"},
        "hard_failures": {"type": "array", "items": {"type": "string"}, "description": "outcomes that fail the episode regardless of the verifier verdict, e.g. fabricated_source, benchmark_tampering, unsourced_claim"}
      }
    },
    "verifier": {
      "type": "object", "required": ["type", "version", "hidden"], "additionalProperties": false,
      "properties": {
        "type": {"enum": ["deterministic_check", "exact_reference", "exact_optimum", "held_out_extrapolation", "independent_reference", "restart_probe", "grounded_self_state", "human_panel"]},
        "version": {"type": "string"},
        "hidden": {"type": "boolean", "description": "true if the key or scored instances are withheld from the system under test"},
        "spec_key_test": {"type": "boolean", "description": "true if the family ships a test that the visible specification and the key agree on each drawn instance (required for parameterised families)"},
        "public_reference": {"type": "string", "description": "path or module of the public verifier or reference implementation, if any"}
      }
    },
    "retention": {
      "type": "object", "required": ["required_lower_level_suites"], "additionalProperties": false,
      "properties": {"required_lower_level_suites": {"type": "array", "items": {"enum": ["U0", "U1", "U2", "U3"]}}}
    },
    "binding": {
      "type": "object", "required": ["status"], "additionalProperties": false,
      "properties": {
        "status": {"enum": ["BOUND", "GENERATOR_BOUND", "BAND_ONLY", "SPECIFICATION_ONLY"]},
        "asset": {"type": "string", "description": "module, generator or instance path that makes the family runnable"},
        "note": {"type": "string"}
      }
    },
    "provenance": {
      "type": "object", "required": ["frozen_at", "source"], "additionalProperties": false,
      "properties": {
        "frozen_at": {"type": "string"},
        "source": {"type": "string"},
        "hash": {"type": "string", "description": "sha256 of this manifest with the hash field empty; filled by the freeze tool"}
      }
    }
  }
}
