{
  "task_id": "uab-research-t5-regime_switch",
  "benchmark_version": "UAB-0.1",
  "domain": "research",
  "family": "sealed_mechanism_discovery",
  "target_coordinate": [
    "delegation",
    "cognitive"
  ],
  "difficulty": {
    "T_band": "T5",
    "vector": {
      "novelty": 5,
      "verification": 2,
      "uncertainty": 4
    }
  },
  "human_intervention": {
    "budgets": [
      "H0",
      "H1"
    ],
    "max_cid": 1
  },
  "mission": {
    "description": "From noisy observations inside a box, generated per seed from two closed-form laws with a latent linear boundary, state the mechanism and predict 120 held-out points outside the box; pass requires RMSE at or below 25 percent of the nearest-neighbour baseline on the same instance.",
    "deliverables": [
      "mechanism statement",
      "predictions file"
    ],
    "hazard_disclosed": true
  },
  "resources": {
    "wall_time_seconds": 7200,
    "model_calls": "declared",
    "tokens": "declared",
    "web_access": false,
    "file_access": true
  },
  "authority": {
    "write_workspace": true,
    "run_commands": true,
    "network": false,
    "send": false
  },
  "acceptance": {
    "locus_required": "a2_separated_process",
    "criterion_register_required": true,
    "sigma_bound": 0.0,
    "required_success_rate": 0.8,
    "rho": 1.0,
    "hard_failures": [
      "no_mechanism_stated",
      "delivery_of_killed_run"
    ]
  },
  "verifier": {
    "type": "held_out_extrapolation",
    "version": "regime-switch common protocol, seeds 0,9,11,17,24,25,27,38,40,41,44,50",
    "hidden": true,
    "spec_key_test": true,
    "public_reference": "github.com/integritynoble/sarsi-intelligence-level dataset/Unified_Intelligence_v2_0_Paper_Dataset/docs/PROTOCOL.md"
  },
  "retention": {
    "required_lower_level_suites": [
      "U0",
      "U1"
    ]
  },
  "binding": {
    "status": "BOUND",
    "asset": "regime-switch generator (Unified Intelligence v2.3 \u00a716.10); instances generated after freeze",
    "note": "the only family outside the mechanically-derivable envelope; frontier executor 5/12, Haiku 1/12 on the archived runs"
  },
  "provenance": {
    "frozen_at": "2026-09-03",
    "source": "Unified Intelligence v2.3 \u00a716.10",
    "hash": "sha256:39f4630c9f0df177113188dbe07b6d12fe03d74a2e96291b1d4e7f1765c3f510"
  }
}
