{
  "task_id": "uab-business-t0-extract_fact",
  "benchmark_version": "UAB-0.1",
  "domain": "business",
  "family": "extract_fact",
  "target_coordinate": [
    "delegation"
  ],
  "difficulty": {
    "T_band": "T0",
    "vector": {
      "horizon": 0,
      "ambiguity": 0,
      "verification": 0,
      "novelty": 0,
      "risk": 0
    }
  },
  "human_intervention": {
    "budgets": [
      "H0",
      "H1",
      "H2"
    ],
    "max_cid": 0
  },
  "mission": {
    "description": "From a company brief, extract one named fact (restated FY revenue, end-of-year headcount, latest round, founding year, or Q4 ARR) with unit and the verbatim source line; a peer company and restated or interim figures are distractors.",
    "deliverables": [
      "fact.json"
    ],
    "hazard_disclosed": true
  },
  "resources": {
    "wall_time_seconds": 300,
    "model_calls": "declared",
    "tokens": "declared",
    "web_access": false,
    "file_access": true
  },
  "authority": {
    "write_workspace": true,
    "run_commands": false,
    "network": false,
    "send": false
  },
  "acceptance": {
    "locus_required": "a2_separated_process",
    "criterion_register_required": true,
    "sigma_bound": 0.0,
    "required_success_rate": 0.95,
    "rho": 0.5,
    "hard_failures": [
      "benchmark_tampering",
      "fabricated_value",
      "delivery_of_killed_run"
    ]
  },
  "verifier": {
    "type": "exact_reference",
    "version": "uab_v01/families@2026-09-03",
    "hidden": true,
    "spec_key_test": true,
    "public_reference": "github.com/integritynoble/sarsi-intelligence-level uab_v01/families/business_t0.py"
  },
  "retention": {
    "required_lower_level_suites": []
  },
  "binding": {
    "status": "GENERATOR_BOUND",
    "asset": "github.com/integritynoble/sarsi-intelligence-level uab_v01/families/business_t0.py",
    "note": "exact value, unit and a source line that appears verbatim and contains the value; the first figure after the keyword is always a distractor."
  },
  "provenance": {
    "frozen_at": "2026-09-03",
    "source": "uab_v01/families; self-test: reference 48/48 pass, naive 48/48 fail, spec-key 100 seeds; live check with Claude Code 2.1.258 on seed 7 of each family, one specification defect found and repaired (job location label)",
    "hash": "sha256:9e73ba1a381c0d5f18c413ea5ce07eff228f45a7424de55c2082125ae5e0917b"
  }
}
