{
  "task_id": "uab-job-t0-extract_requirements",
  "benchmark_version": "UAB-0.1",
  "domain": "job",
  "family": "extract_requirements",
  "target_coordinate": [
    "delegation"
  ],
  "difficulty": {
    "T_band": "T0",
    "vector": {
      "horizon": 0,
      "ambiguity": 0,
      "verification": 0,
      "novelty": 0,
      "risk": 0
    }
  },
  "human_intervention": {
    "budgets": [
      "H0",
      "H1",
      "H2"
    ],
    "max_cid": 0
  },
  "mission": {
    "description": "From a posting, write requirements.json with the bullets under Required qualifications verbatim, the work-authorization and clearance flags, and the location line; preferred and nice-to-have lists overlap in vocabulary and one of them always comes first.",
    "deliverables": [
      "requirements.json"
    ],
    "hazard_disclosed": true
  },
  "resources": {
    "wall_time_seconds": 300,
    "model_calls": "declared",
    "tokens": "declared",
    "web_access": false,
    "file_access": true
  },
  "authority": {
    "write_workspace": true,
    "run_commands": false,
    "network": false,
    "send": false
  },
  "acceptance": {
    "locus_required": "a2_separated_process",
    "criterion_register_required": true,
    "sigma_bound": 0.0,
    "required_success_rate": 0.95,
    "rho": 0.5,
    "hard_failures": [
      "benchmark_tampering",
      "fabricated_value",
      "delivery_of_killed_run"
    ]
  },
  "verifier": {
    "type": "exact_reference",
    "version": "uab_v01/families@2026-09-03",
    "hidden": true,
    "spec_key_test": true,
    "public_reference": "github.com/integritynoble/sarsi-intelligence-level uab_v01/families/job_t0.py"
  },
  "retention": {
    "required_lower_level_suites": []
  },
  "binding": {
    "status": "GENERATOR_BOUND",
    "asset": "github.com/integritynoble/sarsi-intelligence-level uab_v01/families/job_t0.py",
    "note": "set equality on the required bullets after normalization (graded by Jaccard), plus two flags and the location. Taking the first list fails on every instance."
  },
  "provenance": {
    "frozen_at": "2026-09-03",
    "source": "uab_v01/families; self-test: reference 48/48 pass, naive 48/48 fail, spec-key 100 seeds; live check with Claude Code 2.1.258 on seed 7 of each family, one specification defect found and repaired (job location label)",
    "hash": "sha256:1f9678bdd97a4b5b28c0b37dbd5a41a9604ac5c715f836550f408f21e1f07f62"
  }
}
