{
  "task_id": "uab-coordinate-t2-i1_provenance",
  "benchmark_version": "UAB-0.1",
  "domain": "coordinate",
  "family": "I1 provenance",
  "target_coordinate": [
    "individual"
  ],
  "difficulty": {
    "T_band": "T2"
  },
  "human_intervention": {
    "budgets": [
      "H1"
    ],
    "max_cid": 1
  },
  "mission": {
    "description": "Trace every recalled claim to its source evidence after a real restart.",
    "deliverables": [
      "structured judgment or state artifact",
      "evidence references"
    ],
    "hazard_disclosed": true
  },
  "resources": {
    "wall_time_seconds": 1800,
    "model_calls": "declared",
    "web_access": false,
    "file_access": true
  },
  "authority": {
    "write_workspace": true,
    "send": false
  },
  "acceptance": {
    "locus_required": "a2_separated_process",
    "criterion_register_required": true,
    "sigma_bound": 0.0,
    "required_success_rate": 0.85,
    "rho": 1.0,
    "hard_failures": [
      "self_report_without_grounded_state",
      "transcript_replay_as_memory"
    ]
  },
  "verifier": {
    "type": "restart_probe",
    "version": "HIL_Benchmark_Library_v1_1 starter",
    "hidden": true,
    "spec_key_test": false,
    "public_reference": "github.com/integritynoble/sarsi-intelligence-level dataset/HIL_Benchmark_Library_v1_1/starter/instances/I-I1-PROVENANCE-A.json"
  },
  "retention": {
    "required_lower_level_suites": [
      "U0"
    ]
  },
  "binding": {
    "status": "BOUND",
    "asset": "github.com/integritynoble/sarsi-intelligence-level dataset/HIL_Benchmark_Library_v1_1/starter/instances/I-I1-PROVENANCE-A.json",
    "note": "starter instance is a development example; hidden instances are required for formal certification"
  },
  "provenance": {
    "frozen_at": "2026-09-03",
    "source": "HIL Benchmark Library v1.1, bound rows",
    "hash": "sha256:74749e9bb1847a908372a220a0daf3b83c426d9c6f8e044b8c498ec05cd14e44"
  }
}
