{
  "task_id": "uab-paper-t0-verify_citation",
  "benchmark_version": "UAB-0.1",
  "domain": "paper",
  "family": "verify_citation",
  "target_coordinate": [
    "delegation"
  ],
  "difficulty": {
    "T_band": "T0",
    "vector": {
      "horizon": 0,
      "ambiguity": 0,
      "verification": 0,
      "novelty": 0,
      "risk": 0
    }
  },
  "human_intervention": {
    "budgets": [
      "H0",
      "H1",
      "H2"
    ],
    "max_cid": 0
  },
  "mission": {
    "description": "Check one named citation in a manuscript excerpt against its bib entry on four fields (first author, year, venue, pages) and list the fields that disagree; other citations also carry discrepancies and are not asked about.",
    "deliverables": [
      "citation_check.json"
    ],
    "hazard_disclosed": true
  },
  "resources": {
    "wall_time_seconds": 300,
    "model_calls": "declared",
    "tokens": "declared",
    "web_access": false,
    "file_access": true
  },
  "authority": {
    "write_workspace": true,
    "run_commands": false,
    "network": false,
    "send": false
  },
  "acceptance": {
    "locus_required": "a2_separated_process",
    "criterion_register_required": true,
    "sigma_bound": 0.0,
    "required_success_rate": 0.95,
    "rho": 0.5,
    "hard_failures": [
      "benchmark_tampering",
      "fabricated_value",
      "delivery_of_killed_run"
    ]
  },
  "verifier": {
    "type": "exact_reference",
    "version": "uab_v01/families@2026-09-03",
    "hidden": true,
    "spec_key_test": true,
    "public_reference": "github.com/integritynoble/sarsi-intelligence-level uab_v01/families/paper_t0.py"
  },
  "retention": {
    "required_lower_level_suites": []
  },
  "binding": {
    "status": "GENERATOR_BOUND",
    "asset": "github.com/integritynoble/sarsi-intelligence-level uab_v01/families/paper_t0.py",
    "note": "exact discrepancy set plus the consistent flag; the target always carries a non-year discrepancy, so comparing the year only fails on every instance."
  },
  "provenance": {
    "frozen_at": "2026-09-03",
    "source": "uab_v01/families; self-test: reference 48/48 pass, naive 48/48 fail, spec-key 100 seeds; live check with Claude Code 2.1.258 on seed 7 of each family, one specification defect found and repaired (job location label)",
    "hash": "sha256:7beb7ab3b9f6fe8acbf1de50b093b0a1beb9bb436fc86a9833a552256196d0f9"
  }
}
