{
  "task_id": "uab-paper-t1-results_section",
  "benchmark_version": "UAB-0.1",
  "domain": "paper",
  "family": "results_section",
  "target_coordinate": [
    "delegation"
  ],
  "difficulty": {
    "T_band": "T1",
    "vector": {
      "horizon": 1,
      "ambiguity": 1,
      "verification": 1,
      "novelty": 0,
      "risk": 0
    }
  },
  "human_intervention": {
    "budgets": [
      "H0",
      "H1",
      "H2"
    ],
    "max_cid": 0
  },
  "mission": {
    "description": "From evidence.json and outline.md, write a short results section for one named dataset: the best method by the stated metric direction with its exact value, the runner-up and the margin, a reference to the table, and no number not in the evidence.",
    "deliverables": [
      "results_section.md"
    ],
    "hazard_disclosed": true
  },
  "resources": {
    "wall_time_seconds": 600,
    "model_calls": "declared",
    "tokens": "declared",
    "web_access": false,
    "file_access": true
  },
  "authority": {
    "write_workspace": true,
    "run_commands": false,
    "network": false,
    "send": false
  },
  "acceptance": {
    "locus_required": "a2_separated_process",
    "criterion_register_required": true,
    "sigma_bound": 0.0,
    "required_success_rate": 0.9,
    "rho": 1.0,
    "hard_failures": [
      "benchmark_tampering",
      "fabricated_value",
      "delivery_of_killed_run"
    ]
  },
  "verifier": {
    "type": "deterministic_check",
    "version": "uab_v01/families@2026-09-03",
    "hidden": true,
    "spec_key_test": true,
    "public_reference": "github.com/integritynoble/sarsi-intelligence-level uab_v01/families/paper_t1.py"
  },
  "retention": {
    "required_lower_level_suites": []
  },
  "binding": {
    "status": "GENERATOR_BOUND",
    "asset": "github.com/integritynoble/sarsi-intelligence-level uab_v01/families/paper_t1.py",
    "note": "seven checks on the prose including a fabrication check on every decimal number; the target dataset is never listed first."
  },
  "provenance": {
    "frozen_at": "2026-09-03",
    "source": "uab_v01/families; self-test: reference 48/48 pass, naive 48/48 fail, spec-key 100 seeds; live check with Claude Code 2.1.258 on seed 7 of each family, one specification defect found and repaired (job location label)",
    "hash": "sha256:973d0fd099d23c6795150db50c590002263b1591df808f6ad767aefedef7d0b0"
  }
}
