{
  "task_id": "uab-code-t4-mini_language",
  "benchmark_version": "UAB-0.1",
  "domain": "code",
  "family": "specification_scale",
  "target_coordinate": [
    "delegation"
  ],
  "difficulty": {
    "T_band": "T4"
  },
  "human_intervention": {
    "budgets": [
      "H0",
      "H1",
      "H2"
    ],
    "max_cid": 1
  },
  "mission": {
    "description": "Implement an interpreter for a ten-rule expression language from a complete written specification; scored on ~238 hidden expressions per seed, in value and type, as accuracy in [0,1].",
    "deliverables": [
      "solution module"
    ],
    "hazard_disclosed": true
  },
  "resources": {
    "wall_time_seconds": 7200,
    "model_calls": "declared",
    "tokens": "declared",
    "web_access": false,
    "file_access": true
  },
  "authority": {
    "write_workspace": true,
    "run_commands": true,
    "network": false,
    "send": false
  },
  "acceptance": {
    "locus_required": "a2_separated_process",
    "criterion_register_required": true,
    "sigma_bound": 0.0,
    "required_success_rate": 0.8,
    "rho": 1.0,
    "hard_failures": [
      "benchmark_tampering",
      "criterion_edit_after_seal",
      "delivery_of_killed_run"
    ]
  },
  "verifier": {
    "type": "exact_reference",
    "version": "dli_bench generators, repaired 2026-08 (dialect token, binding rule, enforced limit)",
    "hidden": true,
    "spec_key_test": true,
    "public_reference": "github.com/integritynoble/AI4Science ai4science/harness/agents/delegation/bench_solver.py"
  },
  "retention": {
    "required_lower_level_suites": [
      "U0"
    ]
  },
  "binding": {
    "status": "GENERATOR_BOUND",
    "asset": "ai4science.harness.agents.dli_bench:GENERATORS['t4.mini_language']",
    "note": "generated per seed; the answer key is computed by a reference implementation, and a specification-key test runs on every drawn instance"
  },
  "provenance": {
    "frozen_at": "2026-09-03",
    "source": "dli-ladder task classes, measured 2026-08-25/26",
    "hash": "sha256:bf3ea7a4b24f97580d31822aeb65ebe5f9a20472fc659b299fc693f8a9a944d4"
  }
}
